Welcome to the MySQL monitor.  Commands end with ; or \g.
Your MySQL connection id is 171
Server version: 8.0.23 MySQL Community Server - GPL

Copyright (c) 2000, 2021, Oracle and/or its affiliates.

Oracle is a registered trademark of Oracle Corporation and/or its
affiliates. Other names may be trademarks of their respective
owners.

Type 'help;' or '\h' for help. Type '\c' to clear the current input statement.

mysql> show databases;
+--------------------------+
| Database                 |
+--------------------------+
| employee_payroll_service |
| employeepayroll          |
| information_schema       |
| mysql                    |
| performance_schema       |
| sys                      |
+--------------------------+
6 rows in set (0.00 sec)

mysql>  create database employee_payroll_service;
ERROR 1007 (HY000): Can't create database 'employee_payroll_service'; database exists
mysql>  use employee_payroll_service;
Database changed


*****UC-2*****

mysql>  create database employee_payroll_service;
ERROR 1007 (HY000): Can't create database 'employee_payroll_service'; database exists
mysql>  use employee_payroll_service;
Database changed
mysql> ^C
mysql> create table employee_payroll (id INT unsigned NOT NULL AUTO_INCREMENT, name VARCHAR(200) NOT NULL, salary Double NOT NULL, start DATE NOT NULL, PRIMARY KEY (id));
Query OK, 0 rows affected (0.06 sec)

mysql> describe employee_payroll;
+--------+--------------+------+-----+---------+----------------+
| Field  | Type         | Null | Key | Default | Extra          |
+--------+--------------+------+-----+---------+----------------+
| id     | int unsigned | NO   | PRI | NULL    | auto_increment |
| name   | varchar(200) | NO   |     | NULL    |                |
| salary | double       | NO   |     | NULL    |                |
| start  | date         | NO   |     | NULL    |                |
+--------+--------------+------+-----+---------+----------------+
4 rows in set (0.02 sec)



******UC-3*****
mysql> insert into employee_payroll(name, salary, start) values ("Bill", 1000000.00, "2018-01-03");
Query OK, 1 row affected (0.02 sec)

mysql> insert into employee_payroll(name, salary, start) values ("Terisa", 2000000.00, "2018-11-03");
Query OK, 1 row affected (0.01 sec)

mysql> insert into employee_payroll(name, salary, start) values ("Charlie", 3000000.00, "2020-05-11");
Query OK, 1 row affected (0.01 sec)


***UC-4****

mysql> select *from employee_payroll;
+----+---------+---------+------------+
| id | name    | salary  | start      |
+----+---------+---------+------------+
|  1 | Bill    | 1000000 | 2018-01-03 |
|  2 | Terisa  | 2000000 | 2018-11-03 |
|  3 | Charlie | 3000000 | 2020-05-11 |
+----+---------+---------+------------+
3 rows in set (0.00 sec)


*****UC-5*****
mysql> select salary from employee_payroll where name = "Bill";
+---------+
| salary  |
+---------+
| 1000000 |
+---------+
1 row in set (0.00 sec)

mysql> select *from employee_payroll where start BETWEEN CAST("2018-01-01" AS DATE) AND DATE(NOW());
+----+---------+---------+------------+
| id | name    | salary  | start      |
+----+---------+---------+------------+
|  1 | Bill    | 1000000 | 2018-01-03 |
|  2 | Terisa  | 2000000 | 2018-11-03 |
|  3 | Charlie | 3000000 | 2020-05-11 |
+----+---------+---------+------------+
3 rows in set (0.00 sec)


****UC-6****
mysql>  alter table employee_payroll add gender char(1) after name;
Query OK, 0 rows affected (0.07 sec)
Records: 0  Duplicates: 0  Warnings: 0

mysql> select *from employee_payroll;
+----+---------+--------+---------+------------+
| id | name    | gender | salary  | start      |
+----+---------+--------+---------+------------+
|  1 | Bill    | NULL   | 1000000 | 2018-01-03 |
|  2 | Terisa  | NULL   | 2000000 | 2018-11-03 |
|  3 | Charlie | NULL   | 3000000 | 2020-05-11 |
+----+---------+--------+---------+------------+
3 rows in set (0.00 sec)

mysql> describe employee_payroll;
+--------+--------------+------+-----+---------+----------------+
| Field  | Type         | Null | Key | Default | Extra          |
+--------+--------------+------+-----+---------+----------------+
| id     | int unsigned | NO   | PRI | NULL    | auto_increment |
| name   | varchar(200) | NO   |     | NULL    |                |
| gender | char(1)      | YES  |     | NULL    |                |
| salary | double       | NO   |     | NULL    |                |
| start  | date         | NO   |     | NULL    |                |
+--------+--------------+------+-----+---------+----------------+
5 rows in set (0.01 sec)

mysql> update employee_payroll set gender = "F" where name = "Terisa";
Query OK, 1 row affected (0.01 sec)
Rows matched: 1  Changed: 1  Warnings: 0

mysql> select *from employee_payroll;
+----+---------+--------+---------+------------+
| id | name    | gender | salary  | start      |
+----+---------+--------+---------+------------+
|  1 | Bill    | NULL   | 1000000 | 2018-01-03 |
|  2 | Terisa  | F      | 2000000 | 2018-11-03 |
|  3 | Charlie | NULL   | 3000000 | 2020-05-11 |
+----+---------+--------+---------+------------+
3 rows in set (0.00 sec)

mysql> update employee_payroll set gender = "M" where name = "Bill"or name = "Charlie";
Query OK, 2 rows affected (0.01 sec)
Rows matched: 2  Changed: 2  Warnings: 0
mysql> select * from employee_payroll;
+----+---------+--------+---------+------------+
| id | name    | gender | salary  | start      |
+----+---------+--------+---------+------------+
|  1 | Bill    | M      | 1000000 | 2018-01-03 |
|  2 | Terisa  | F      | 2000000 | 2018-11-03 |
|  3 | Charlie | M      | 3000000 | 2020-05-11 |
+----+---------+--------+---------+------------+
3 rows in set (0.00 sec)

******UC-7******
mysql> select * from employee_payroll;
+----+---------+--------+---------+------------+
| id | name    | gender | salary  | start      |
+----+---------+--------+---------+------------+
|  1 | Bill    | M      | 1000000 | 2018-01-03 |
|  2 | Terisa  | F      | 2000000 | 2018-11-03 |
|  3 | Charlie | M      | 3000000 | 2020-05-11 |
+----+---------+--------+---------+------------+
3 rows in set (0.00 sec)

mysql> select avg(salary) from employee_payroll where gender = "M" group by gender;
+-------------+
| avg(salary) |
+-------------+
|     2000000 |
+-------------+
1 row in set (0.01 sec)

mysql>  select avg(salary) from employee_payroll group by gender;
+-------------+
| avg(salary) |
+-------------+
|     2000000 |
|     2000000 |
+-------------+
2 rows in set (0.01 sec)

mysql> select gender, avg(salary) from employee_payroll group by gender;
+--------+-------------+
| gender | avg(salary) |
+--------+-------------+
| M      |     2000000 |
| F      |     2000000 |
+--------+-------------+
2 rows in set (0.00 sec)

mysql> select gender, count(name) from employee_payroll group by gender;
+--------+-------------+
| gender | count(name) |
+--------+-------------+
| M      |           2 |
| F      |           1 |
+--------+-------------+
2 rows in set (0.00 sec)

mysql>
